date,ticker,open_usd,high_usd,low_usd,close_usd,adj_close_usd,volume,event_flag,event_description
2020-04-07,OVR,4.00,4.40,3.80,4.20,4.20,380000,1,Launch of OrbScout Drone with pilot customers
2021-12-01,OVR,7.20,7.70,6.85,7.50,7.50,620000,1,NaviFly AI Suite commercial beta launch
2022-08-19,OVR,9.90,10.40,9.50,10.25,10.25,710000,1,Large National Grid contract signed for infrastructure inspection
2023-04-20,OVR,11.80,12.10,11.25,11.35,11.35,720000,1,Public controversy over drone safety protocols—internal review initiated
2023-09-18,OVR,11.50,12.00,11.00,11.75,11.75,690000,1,Review clears safety concerns; product updates launched
2024-02-10,OVR,12.00,12.50,11.75,12.40,12.40,780000,1,Expansion partnership announced with Boeing and Medisafe Health
2024-07-05,OVR,13.10,13.80,12.70,13.65,13.65,850000,1,New drone AI navigation algorithms demonstrated at conference
2025-02-10,OVR,15.00,15.50,14.50,15.25,15.25,900000,1,Strategic JV with Borealis CloudWorks (C003) and QuantumQuill Software (C005)
2025-08-19,OVR,16.10,16.75,15.90,16.65,16.65,720000,0,Strong Q2 earnings reported with positive guidance
