date,type,description,detailed_impact_on_c010,global_context,mitigation_by_c010,related_event_id
2020-06-01,Climate Policy,Increasing carbon reduction mandates,Growing demand for carbon capture solutions,Paris Agreement implementation,Technology development acceleration,EV010001
2021-08-01,IP Environment,Cleantech patent race,Patent protection critical for competitive advantage,Green technology innovation surge,Strategic patent filing,EV010002
2022-10-01,Industrial Partnerships,Chemical industry sustainability focus,BASF partnership validates market demand,Corporate ESG commitments,Strategic partnership development,EV010003
2023-05-01,Energy Transition,Industrial decarbonization acceleration,Siemens deployment reflects sector trend,Global energy transformation,Customer-focused solutions,EV010004
2024-01-01,Regulatory Scrutiny,Environmental compliance enforcement,EPA investigation reflects tighter oversight,Regulatory enforcement increasing,Enhanced compliance protocols,EV010005
2024-07-01,Regulatory Resolution,Compliance standards clarification,EPA clearance enables continued operations,Regulatory framework stabilization,Proactive compliance measures,EV010006
2025-02-01,Technology Integration,Cross-sector cleantech collaboration,JV formation creates integrated solutions,Technology convergence trend,Strategic alliance formation,EV010007
2025-08-01,Carbon Markets,Carbon credit monetization growth,Revenue diversification through credit programs,Carbon pricing mechanisms expanding,Carbon credit strategy,EV010008
2020-11-01,Certification Standards,Third-party validation requirements,Carbon Trust certification enhances credibility,Sustainability verification demand,Certification strategy,EV010009
2021-03-01,Healthcare Sustainability,Medical facility decarbonization,Healthcare sector adoption of carbon solutions,Healthcare sustainability initiatives,Vertical market expansion,EV010010
2021-12-01,Clean Technology Investment,Venture capital focus on cleantech,Series A funding reflects investor confidence,Climate technology investment surge,Growth capital strategy,EV010011
2022-04-01,Product Diversification,Industrial purification demand,FlowFilter launch addresses market need,Industrial environmental compliance,Product portfolio expansion,EV010012
2022-09-01,Industry Leadership,Thought leadership importance,Conference presence builds brand recognition,Cleantech sector maturation,Industry engagement strategy,EV010013
2023-01-01,Supply Chain Security,Raw materials supply stability,DowDuPont agreement ensures production continuity,Global supply chain challenges,Supply chain diversification,EV010014
2023-07-01,Geographic Expansion,European carbon market growth,EU subsidiary establishment targets regional demand,European Green Deal implementation,International expansion,EV010015
2023-10-01,Innovation Competition,Advanced technology development,Patent filing maintains competitive position,Cleantech innovation acceleration,R&D investment strategy,EV010016
2024-03-01,Industry Recognition,Awards and validation importance,Recognition validates technology approach,Cleantech sector credibility,Brand positioning strategy,EV010017
2024-05-01,Partnership Success,Collaboration outcomes,BASF milestone demonstrates partnership value,Strategic partnership importance,Partnership management,EV010018
2024-09-01,Technology Advancement,Breakthrough innovation impact,Enhanced materials provide competitive advantage,Technology leadership requirements,Innovation focus,EV010019
2024-11-01,ESG Reporting,Sustainability transparency demand,Comprehensive reporting meets stakeholder needs,ESG disclosure requirements,Transparency strategy,EV010020
2025-01-01,Government Support,Federal clean technology programs,DOE contract provides validation and revenue,Government cleantech investment,Public sector engagement,EV010021
2025-03-01,Manufacturing Scale,Production capacity requirements,Facility expansion enables market growth,Industrial scaling needs,Operations expansion,EV010022
2025-04-01,Carbon Monetization,Carbon credit program participation,CARB enrollment creates additional revenue,Carbon pricing expansion,Revenue diversification,EV010023
2025-06-01,Talent Acquisition,Specialized skills demand,Research team expansion supports innovation,Clean technology talent competition,Human capital investment,EV010024
2025-07-01,Energy Integration,Cross-sector technology convergence,TerraVolt partnership combines complementary technologies,Energy storage and capture convergence,Strategic collaboration,EV010025
