date,company_id,source,sentiment_score,volume,top_terms,excerpt,detailed_opinion
2020-06-15,C010,CleanTech News,0.42,320,"prototype;carbon;capture","EcoFlow's CarbonLock demonstration impresses industrial partners.","Technology validation promising for commercialization"
2021-08-20,C010,Patent News,0.38,280,"patent;sustainable;manufacturing","EcoSynth process patent strengthens competitive position.","IP protection valuable in cleantech sector"
2022-10-12,C010,Investment News,0.52,640,"basf;partnership;investment","$15M BASF investment validates carbon capture technology.","Major chemical company endorsement significant"
2023-05-18,C010,Industrial News,0.44,420,"siemens;deployment;purification","FlowFilter systems successfully deployed at energy facilities.","Commercial validation demonstrates market traction"
2024-01-25,C010,Regulatory News,-0.38,760,"epa;investigation;compliance","Environmental compliance investigation raises concerns.","Regulatory scrutiny impacts investor confidence"
2024-07-10,C010,Environmental News,0.32,580,"epa;clearance;protocols","EPA investigation resolved with enhanced monitoring.","Compliance resolution restores operational status"
2025-02-10,C010,Partnership News,0.48,690,"joint;venture;green","Green Technology Alliance creates integrated solutions.","Strategic collaboration expands market opportunities"
2025-08-19,C010,Financial News,0.51,720,"earnings;carbon;credits","Strong Q2 results driven by carbon credit monetization.","Revenue diversification strategy proving successful"
2020-11-30,C010,Sustainability News,0.40,290,"certification;carbon;trust","Carbon Trust certification enhances market credibility.","Third-party validation important for buyers"
2021-03-22,C010,Healthcare News,0.36,340,"healthcare;carbon;capture","Innovative application in healthcare facility sustainability.","Vertical diversification shows technology versatility"
2021-12-08,C010,Venture News,0.45,490,"series;funding;cleantech","Series A funding supports scaling operations.","Clean technology investor confidence growing"
2022-04-14,C010,Product News,0.41,380,"flowfilter;industrial;purification","Commercial product launch diversifies revenue streams.","Product portfolio expansion strategic"
2022-09-27,C010,Conference Coverage,0.47,420,"keynote;cleantech;summit","CEO presentation reinforces industry leadership.","Thought leadership positioning valuable"
2023-01-16,C010,Supply Chain News,0.35,310,"dowdupont;materials;agreement","Raw materials supply agreement ensures production stability.","Supply chain security important for scaling"
2023-07-25,C010,Expansion News,0.43,380,"european;subsidiary;market","European expansion targets growing carbon market.","Geographic diversification strategy sound"
2023-10-31,C010,Innovation News,0.46,350,"catalyst;patent;technology","Advanced catalyst patents demonstrate innovation.","Continued technology development encouraging"
2024-03-19,C010,Awards Coverage,0.49,290,"innovation;awards;cleantech","Industry awards recognize technology breakthrough.","Peer recognition validates approach"
2024-05-28,C010,Collaboration News,0.44,320,"basf;milestone;development","Successful joint development validates partnership.","Collaboration outcomes demonstrate value"
2024-09-11,C010,Technology News,0.53,410,"breakthrough;efficiency;improvement","60% efficiency improvement in capture materials.","Significant technology advancement achieved"
2024-11-26,C010,ESG News,0.41,380,"sustainability;metrics;transparency","Comprehensive sustainability reporting appreciated.","Transparency builds stakeholder confidence"
2025-01-18,C010,Government News,0.48,350,"doe;contract;demonstration","Department of Energy contract validates technology.","Federal endorsement significant for market"
2025-03-25,C010,Manufacturing News,0.39,290,"expansion;capacity;production","Manufacturing expansion supports growth.","Operational scaling enables market demands"
2025-04-30,C010,Carbon Market News,0.46,410,"carbon;credits;california","Participation in carbon credit program strategic.","Carbon monetization creates additional value"
2025-06-12,C010,Employment News,0.33,260,"hiring;scientists;expansion","Research team expansion signals growth ambitions.","Talent acquisition supports innovation"
2025-07-20,C010,Energy News,0.42,390,"terravolt;integration;storage","Energy storage integration expands applications.","Cross-sector partnerships create opportunities"
