date,type,description,detailed_impact_on_c021,global_context,mitigation,event_related_id
2020-09-01,Technology,Low‑energy RO breakthroughs,Demo improves market credibility,Water scarcity drive,R&D investment,EV021001
2021-08-01,PPP Infra,Water PPP acceleration in Africa,Kenya BOT project secured,Infrastructure investment surge,Long‑term PPP strategy,EV021002
2022-11-01,Renewables,Integration of solar in desal,SunDesal positions company as innovator,Climate push,Product scaling,EV021003
2023-06-01,Infrastructure,Large PPP BOT deals,Kenya BOT expands pipeline,Africa water infra gap,PPP funding partnerships,EV021004
2024-03-01,Environmental Risk,Brine disposal scrutiny,Regulators hesitant on traditional disposal,NGO activism,Zero‑brine R&D,EV021005
2024-09-01,Circular Economy,Minerals recovery from brine,Solution restores regulatory acceptance,Global focus on resource reuse,Circular innovation,EV021006
2025-02-01,Strategic JV,Global alliances,JVs open mega‑project deals,Worldwide infra consortia,JV creation,EV021007
2025-08-01,Financial,Strong orderbook,Record revenues boost valuation,World water scarcity,Investor engagement,EV021008
